{
  "id": "feature-001",
  "title": "User Login System",
  "description": "Implement a secure user login system with email/password authentication",
  "tasks": [
    {
      "id": "task-001",
      "description": "Create login UI component with email and password fields",
      "dependencies": [],
      "status": "in_progress",
      "deliveryPrompt": "Create a login UI component with email and password input fields, a submit button, and proper form validation. Style it according to our design system."
    },
    {
      "id": "task-002",
      "description": "Implement authentication API endpoint",
      "dependencies": ["task-001"],
      "status": "pending",
      "deliveryPrompt": "Create a POST /api/auth/login endpoint that accepts email and password, validates credentials, and returns a JWT token."
    },
    {
      "id": "task-003",
      "description": "Connect UI to authentication API",
      "dependencies": ["task-001", "task-002"],
      "status": "pending",
      "deliveryPrompt": "Connect the login UI component to the authentication API. Handle loading states, error messages, and successful login redirects."
    }
  ],
  "acceptanceCriteria": [
    {
      "id": "ac-001",
      "description": "User can enter email and password and submit the form",
      "testType": "playwright",
      "testPath": "tests/login.spec.ts"
    },
    {
      "id": "ac-002",
      "description": "Invalid credentials show appropriate error message",
      "testType": "playwright",
      "testPath": "tests/login-errors.spec.ts"
    },
    {
      "id": "ac-003",
      "description": "Successful login redirects to dashboard",
      "testType": "playwright",
      "testPath": "tests/login-success.spec.ts"
    }
  ],
  "qaRules": [
    {
      "question": "what should happen after successful login",
      "answer": "User should be redirected to the dashboard with a valid JWT token stored",
      "confidence": "high"
    },
    {
      "question": "what validation is needed for email",
      "answer": "Email should be validated for proper format (user@domain.com)",
      "confidence": "medium"
    }
  ]
}
